<?xml version="1.0" encoding="UTF-8"?>

<!DOCTYPE ai SYSTEM "ai.dtd">

<ai>
  <aiPlayer>
    <name>mm_ai</name>
    <className>org.pente.gameServer.server.MarksAIPlayer</className>
    <numLevels>8</numLevels>
    <validGames>
      <validGame>Pente</validGame>
      <validGame>Keryo-Pente</validGame>
    </validGames>
    <options>
      <option>
        <optionName>configDirectory</optionName>
        <optionValue>@conf@/marksAI</optionValue>
      </option>
    </options>
  </aiPlayer>
  <aiPlayer>
    <name>mmai</name>
    <className>org.pente.gameServer.server.MMAIPlayer</className>
    <numLevels>8</numLevels>
    <validGames>
      <validGame>Pente</validGame>
      <validGame>Keryo-Pente</validGame>
      <validGame>Poof-Pente</validGame>
      <validGame>Connect6</validGame>
      <validGame>Boat-Pente</validGame>
      <validGame>O-Pente</validGame>
    </validGames>
    <options>
      <option>
        <optionName>binaryPath</optionName>
        <optionValue>/usr/local/bin/mmai_player</optionValue>
      </option>
      <option>
        <optionName>dataDirectory</optionName>
        <optionValue>@conf@/marksAI</optionValue>
      </option>
    </options>
  </aiPlayer>
</ai>

